{
  "note": "UN Security Council in 2000 and the regional groups that elect its non-permanent members. Elections from 2002 on are simulated within each group. Resolution and voting values are gameplay estimates.",
  "permanent": [
    "CHN",
    "FRA",
    "RUS",
    "GBR",
    "USA"
  ],
  "seats": {
    "african": 3,
    "asia_pacific": 2,
    "eastern_european": 1,
    "latin_american": 2,
    "western_european_and_others": 2
  },
  "groups": {
    "african": [
      "DZA",
      "AGO",
      "BEN",
      "BWA",
      "BFA",
      "BDI",
      "CPV",
      "CMR",
      "CAF",
      "TCD",
      "COM",
      "COD",
      "DJI",
      "EGY",
      "GNQ",
      "ERI",
      "SWZ",
      "ETH",
      "GAB",
      "GMB",
      "GHA",
      "GIN",
      "GNB",
      "CIV",
      "KEN",
      "LSO",
      "LBR",
      "LBY",
      "MDG",
      "MWI",
      "MLI",
      "MRT",
      "MUS",
      "MAR",
      "MOZ",
      "NAM",
      "NER",
      "NGA",
      "COG",
      "RWA",
      "STP",
      "SEN",
      "SYC",
      "SLE",
      "SOM",
      "ZAF",
      "SSD",
      "SDN",
      "TZA",
      "TGO",
      "TUN",
      "UGA",
      "ZMB",
      "ZWE"
    ],
    "asia_pacific": [
      "AFG",
      "BHR",
      "BGD",
      "BTN",
      "BRN",
      "KHM",
      "CHN",
      "CYP",
      "FSM",
      "FJI",
      "IND",
      "IDN",
      "IRN",
      "IRQ",
      "JPN",
      "JOR",
      "KAZ",
      "KIR",
      "KWT",
      "KGZ",
      "LAO",
      "LBN",
      "MYS",
      "MDV",
      "MHL",
      "MNG",
      "MMR",
      "NRU",
      "NPL",
      "PRK",
      "OMN",
      "PAK",
      "PLW",
      "PNG",
      "PHL",
      "QAT",
      "WSM",
      "SAU",
      "SGP",
      "SLB",
      "KOR",
      "LKA",
      "SYR",
      "TJK",
      "THA",
      "TLS",
      "TON",
      "TKM",
      "TUV",
      "ARE",
      "UZB",
      "VUT",
      "VNM",
      "YEM"
    ],
    "eastern_european": [
      "ALB",
      "ARM",
      "AZE",
      "BLR",
      "BIH",
      "BGR",
      "HRV",
      "CZE",
      "EST",
      "GEO",
      "HUN",
      "LVA",
      "LTU",
      "MDA",
      "MNE",
      "MKD",
      "POL",
      "ROU",
      "RUS",
      "YUG",
      "SVK",
      "SVN",
      "UKR"
    ],
    "latin_american": [
      "ATG",
      "ARG",
      "BHS",
      "BRB",
      "BLZ",
      "BOL",
      "BRA",
      "CHL",
      "COL",
      "CRI",
      "CUB",
      "DMA",
      "DOM",
      "ECU",
      "SLV",
      "GRD",
      "GTM",
      "GUY",
      "HTI",
      "HND",
      "JAM",
      "MEX",
      "NIC",
      "PAN",
      "PRY",
      "PER",
      "KNA",
      "LCA",
      "VCT",
      "SUR",
      "TTO",
      "URY",
      "VEN"
    ],
    "western_european_and_others": [
      "AND",
      "AUS",
      "AUT",
      "BEL",
      "CAN",
      "DNK",
      "FIN",
      "FRA",
      "DEU",
      "GRC",
      "ISL",
      "IRL",
      "ISR",
      "ITA",
      "LIE",
      "LUX",
      "MLT",
      "MCO",
      "NLD",
      "NZL",
      "NOR",
      "PRT",
      "SMR",
      "ESP",
      "SWE",
      "CHE",
      "TUR",
      "GBR",
      "USA"
    ]
  },
  "elected": [
    {
      "tags": [
        "ARG",
        "CAN",
        "MYS",
        "NAM",
        "NLD"
      ],
      "from": "1999-01-01",
      "until": "2000-12-31"
    },
    {
      "tags": [
        "BGD",
        "JAM",
        "MLI",
        "TUN",
        "UKR"
      ],
      "from": "2000-01-01",
      "until": "2001-12-31"
    },
    {
      "tags": [
        "COL",
        "IRL",
        "MUS",
        "NOR",
        "SGP"
      ],
      "from": "2001-01-01",
      "until": "2002-12-31"
    }
  ],
  "source": [
    {
      "url": "https://en.wikipedia.org/wiki/List_of_members_of_the_United_Nations_Security_Council",
      "title": "Wikipedia: List of members of the United Nations Security Council",
      "accessed": "2026-10-15"
    },
    {
      "url": "https://en.wikipedia.org/wiki/United_Nations_Regional_Groups",
      "title": "Wikipedia: United Nations Regional Groups",
      "accessed": "2026-10-15"
    }
  ],
  "confidence": "verified"
}
